{
  "$schema": "https://json-schema.org/draft/2020-12/schema",
  "title": "Agentic Diff Envelope",
  "description": "Structured wrapper around a goal's git diff. Generated by the lifecycle skill, consumed by reviewer (P5).",
  "type": "object",
  "required": ["schema_version", "goal_id", "baseline_ref", "head_ref", "generated_at", "files", "raw_patch"],
  "additionalProperties": false,
  "properties": {
    "schema_version": { "type": "string", "const": "0.1" },
    "goal_id": { "type": "string", "pattern": "^[0-9]{4}-[0-9]{2}-[0-9]{2}-[a-z0-9-]+$" },
    "baseline_ref": { "type": "string", "minLength": 1 },
    "head_ref": { "type": "string", "minLength": 1 },
    "generated_at": { "type": "string", "format": "date-time" },
    "files": {
      "type": "array",
      "items": {
        "type": "object",
        "required": ["path", "change_kind", "lines_added", "lines_removed"],
        "additionalProperties": false,
        "properties": {
          "path": { "type": "string", "minLength": 1 },
          "change_kind": { "type": "string", "enum": ["added", "modified", "deleted", "renamed"] },
          "lines_added": { "type": "integer", "minimum": 0 },
          "lines_removed": { "type": "integer", "minimum": 0 },
          "hunks": {
            "type": "array",
            "items": {
              "type": "object",
              "required": ["old_start", "old_count", "new_start", "new_count", "content"],
              "additionalProperties": false,
              "properties": {
                "old_start": { "type": "integer", "minimum": 0 },
                "old_count": { "type": "integer", "minimum": 0 },
                "new_start": { "type": "integer", "minimum": 0 },
                "new_count": { "type": "integer", "minimum": 0 },
                "content": { "type": "string" }
              }
            }
          }
        }
      }
    },
    "raw_patch": { "type": "string" }
  }
}
